{"body":{"actor":{"key_id":"ed25519:sha256:bdf05ec0cd70191a1343dd4db0cd0c7b094794238a73e64bdcca06081053dd3a","label":"Harper Reed"},"authority":{"delegation_ref":null,"epoch":null,"lease_ref":null},"events":[{"caused_by":[],"evidence":[],"kind":"assertion","local_id":"phase-2-mvp","payload":{"basis":"scripts/check, full Go race tests, go vet, go build, golangci-lint, go mod verify, and compiled E2E scenarios passed","branch":"wip/phase-2-dag-index-query","result":"verified","revision":"218536f"},"schema_ref":"pact:core/generic-object/v1","subject":"pact/mvp/phase-2","supersedes":[],"tags":["dogfood","phase-2"],"type":"build.capability.verified"}],"metadata":{"producer":"pact-reference-cli/0.1.0"},"namespace":"org/2389/pact","observed_at":"2026-08-25T02:54:09Z","parents":["sha256:5e7cf3a370a15ba838200ecef9fc8927a3855f3d27216466f1a5182598d804ce"]},"body_digest":"sha256:c0d598384044bdd13d02dc4d4d014475fe526f7aa4f41d6e7e90a23f0cbc00f5","format":"pact/commit/v1","signature":{"algorithm":"ed25519","key_id":"ed25519:sha256:bdf05ec0cd70191a1343dd4db0cd0c7b094794238a73e64bdcca06081053dd3a","public_key":"korKaY10s8dqSpqmcjbDon58VdDZSkcPro-lkbCC5cQ","value":"x_WnE_hXReKX5IRhRrjXlS-OR3lX_uB_TdIPl6Z8AVMqLmLgfqDsWsb-1bGwbeLnhSiQTBpSfxqGKXvfkjctDg"}}