{"body":{"actor":{"key_id":"ed25519:sha256:bdf05ec0cd70191a1343dd4db0cd0c7b094794238a73e64bdcca06081053dd3a","label":"Harper Reed"},"authority":{"delegation_ref":null,"epoch":null,"lease_ref":null},"events":[{"caused_by":[],"evidence":[],"kind":"assertion","local_id":"phase-0-1-mvp","payload":{"basis":"scripts/check, full Go race tests, go vet, go build, and golangci-lint passed","branch":"wip/phase-0-1-core","result":"verified","revision":"9428ad1"},"schema_ref":"pact:core/generic-object/v1","subject":"pact/mvp/phase-0-1","supersedes":[],"tags":["dogfood","phase-0","phase-1"],"type":"build.capability.verified"}],"metadata":{"producer":"pact-reference-cli/0.1.0"},"namespace":"org/2389/pact","observed_at":"2026-08-24T14:56:04Z","parents":[]},"body_digest":"sha256:f0aa7231ee0f1b506619362c87ff5bb566ce6b63cdf040753c8c4864d8650bd8","format":"pact/commit/v1","signature":{"algorithm":"ed25519","key_id":"ed25519:sha256:bdf05ec0cd70191a1343dd4db0cd0c7b094794238a73e64bdcca06081053dd3a","public_key":"korKaY10s8dqSpqmcjbDon58VdDZSkcPro-lkbCC5cQ","value":"ItQT_s8B9AQZZiiwMwEy980z54ONB6XzfBsIY8sYJdSeapw76cd1QSIJfSLnZU6AGkdPQN5YWYqNV49LxeiFDg"}}